"review_text","review_stars","review_auth_id","review_date"
"This is a very nice restaurant, pulling out all the stops on classic Peking cuisine and roasting the ducks right in the middle of the restaurant.

Obviously the Peking Roast Duck Pancakes were fantastic but so too was the ""fried squirrel fish"" in mandarin sauce. I've never had anything like it but it was a beautiful fish, both to look at and to eat.

Prices are very reasonable and the service is attentive but only if you speak Chinese. We arrived before our hosts and spent an uncomfortable fifteen minutes being ignored by staff too scared to try and speak to us!! Not a problem, just the reality of non-tourist places in China.

All up, a very good Chinese dining experience and I'll definitely be back.","4 из 5 кружков","BCB8090E3403D092F5F11DDEC189F07D","16 марта 2017"
"I went with some friends due to a hotel recommendation. It totally changed my opinion on Chinese food. Food was great, loved the filled tomatoes, the dumplings and the duck. Very reasonable priced for what you get. Nice decoration. No English with the staff but this is pretty the norm in Beijing .","4 из 5 кружков","8531B5F434FE90FBD0D927AF5B38285C","14 марта 2017"
"A must to try for roast duck and the dish will come with complimentary soup. Another dish to experience is the pork ribs, it comes with a poem and sprinkle of snow flakes when the dish arrives.","4 из 5 кружков","BA869F947B19CFA438DB3012281D134B","8 марта 2017"
"Wow, amazing food, great restaurant and incredible location. The Pekin duck was the best of my entire trip but also wine and desserts.

The only problem is the language ! Nobody but just one employee speaks a little English, even ask for sparkling water was a funny situation.

10/10!!! Highly recommended","4 из 5 кружков","B99A3B3BA3FA004EA21B813D3FDB5D23","26 февраля 2017"
"Roasted to order and delicious, D Dong now has two sizes; a smaller duck perfect for two, rather than a half large duck. Crispy, not greasy and carved at your table, all you need is two more dishes (from their complete menu), some rice and a glass of wine and there you have a memorable meal. Service was warm and helpful with English no problem. Setting is modern with proper table settings. A dining experience to enjoy!","5 из 5 кружков","2BF55F669875316855DA868B70C7D5FE","22 февраля 2017"
"The restaurant was nice ! The staff doesn't speak much English but you can manage with the picture of the food . The duck was very good great taste ! Definitely would recommend the place !","4 из 5 кружков","5986E106DC3F327D064CED3C8BC0A8E1","18 февраля 2017"
"The duck was delicious. The place we didnt like a lot because it was hot and too full. We also had noodles and rice and were all amazing. The restaurant is beautiful and every dish is a work of art and delicious! Of course the masterpiece was the duck which is a must when visiting China.","4 из 5 кружков","748617BC87ABF010E906059AC240A0DC","9 февраля 2017"
"Travelled to Beijing for a few short days whilst in China and had a local driver to take us to our accommodation and also the Great Wall. He recommended this place to us and it did not disappoint!! Huge restaurant and so much Duck! It was melt in your mouth and a great atmosphere. Would highly recommend to anyone travelling close to this area.","5 из 5 кружков","575BFD1B5E436C1C9B10B36C61BCF684","16 марта 2017"
"Great service, the staff showed me how to eat the duck by wrapping it in a crepe, which they call a pancake. I speak enough Mandarin to be dangeous.","5 из 5 кружков","BA5D479A883DEC5CEAAB3657B7F2704D","14 марта 2017"
"My sister had read the reviews and determined that this would be a dinner stop for us. We arrived at the restaurant at 5:30pm, just after seeing an acrobat show. The restaurant was fairly empty. But, the hostess showed us a paper that said we had to be done but 6:30pm. I'm guessing they were expecting a full house based upon reservations. Our server did not speak English, but made every effort to help us make good selections. We knew we wanted the duck...why else would you go there? He suggested a side dish that was so good. Not sure what it was called, but it was very good. It was a dish of sauteed greens with garlic and butter. It was very tasty. While it was wilted, it was still crisp in my opinion, it was cooked perfectly. They brought out our duck and watching the chef slice and plate it was a treat. Be sure to order the condiments. Another server who spoke some English, gave us a demonstration on how to eat the duck. Everything about it was superb. After our meal, we were presented with some fresh mandarin oranges that were so sweet...a great palate cleanser. And for all this, we paid $66US, including 2 beers. We had read that this place was pricey. The atmosphere suggested the same. The service would justify a higher price tag. But, that was not the case. We had an excellent meal, a true Beijing foodie experience, and all for what we felt was extremely reasonable. Oh, and we walked out of the restaurant at 6:30pm without ever feeling rushed. Don't miss this one!","5 из 5 кружков","51D6F685F04F5E981577EBEB27A2ECBA","8 марта 2017"
"I went two times to Da Dong and I can recommend the branch in Sanlitun since the atmosphere is very nice. The Beijing duck is delicious and the other dishes are very good as well. Overall, I will definitely go there next time as well even though it is quite expensive.","4 из 5 кружков","5E06998120A001E484AA8EAAF1154410","Отзыв написан 3 февраля 2017"
"The duck is superlative, so I'll move on to the other meals (the menu is quite extensive): they're all amazing. From fried rice to braised beef, each dish has such bold yet complex flavours that they're unlike any other Chinese restaurant I've been to. You really can't go wrong.

The service is great and because it's Peking duck, you won't have to wait long at all. We also received free lanterns because it was Chinese new year!!

Importantly, it's much cheaper than you'd expect for such a high-class restaurant.","5 из 5 кружков","74EFEC13502EE4B4FE7E4886F832FA9A","Отзыв написан 30 января 2017"
"I went to this place for dinner, along with my other colleagues (including locals), after our training session. Now, Im a (Indian) vegetarian, little did my colleagues knew prior. So they ordered a lot of meat, including the famous Peking Duck. Soon, I was enjoying some salads, and tried some of the deserts, not very sweet though. The overall ambiance was quite good, not sure if they have many veg dishes. It was a good experience. Staff was courteous.","4 из 5 кружков","DD42D3FF90E53E85D3129C9C05528563","Отзыв написан 27 января 2017"
"My husband had been at this restaurant before with a customer and he took me here while we were in Beijing last November. Service was slow at first but once it got started they were great. The Peking Duck was absolutely spectacular! The server gives you a demonstration on how to add sugar to the duck skin (my favorite) and which sauces to use. You won't be disappointed.","5 из 5 кружков","D33D4373FB73E50F20432FEEE9843E23","Отзыв написан 24 января 2017"
"Da Dong is the place the hotel sends westerners when they want to have Peking Duck in Beijing. Da Dong is a good choice but their are better places that are less expensive when you are with the locals. The only knock on this place is that the service was so so.","4 из 5 кружков","A54821E54956EE067CE68202C08D0FC7","Отзыв написан 22 января 2017"
"In the summer of 2015, on our trip to China, my family and I went to the Da Dong Roast Duck Restaurant during our short stay in Beijing. It was recommended by our travel agency. This very modern restaurant, located above a shopping mall, is totally unexpected while walking through the neighbourhoods of Beijing. The restaurant emits quality and hygiene, which is not obvious in China. The food itself was absolutely scrumptious. We all went for the duck on the menu because you can’t go to Beijing without having the famous Peking Duck. It was well cooked and delightful. Although, the service wasn’t very good. We had to ask several times for drinks and we had to be very patient to getting our food, even though the restaurant wasn't very busy.
I would highly recommend it to others. Although, you have to keep in mind that the food is pretty expensive.","4 из 5 кружков","F2340856DA20D5E2B4A176735A11F6A5","Отзыв написан 22 января 2017"
"So, this place is right next to a multi floor shopping mall, where we wandered around lost for a good half an hour. Go outside of the mall and take the elevator up.
That said, great food, we all had the duck, of course. They cook it in giant open flame ovens that you can see.
The restaurant itself is beautiful and modern.","4 из 5 кружков","A5B3F3A7A6B12A399D82DEE0BCF6D6EC","Отзыв написан 18 января 2017"
"Great place, Duck was well prepared and served with excellence. We had a great time with our family.","5 из 5 кружков","3A194B9FB769C5E5A043A0FB81BB9507","Отзыв написан 17 января 2017"
"The Peking duck was good but expensive. Could have the same at other restaurants at lower prices. The rest of food was also very expensive. Hence, if you are looking for value for money food, better avoid it.","3 из 5 кружков","3DD42561DE3971A4CE6D575EFB09D1B7","Отзыв написан 13 января 2017"
"We were recommended toe Da Dong restaurant in Wanfujing Street and the reviews on Tripadvisor were accurate.
We had to queue for about 30 minutes at 1930 and this is normal unless you have a reservation. We had been told that the restaurant did not accept reservations after 1830 but that doesn't seem to be correct.

We had half a superlean Peking Duck (288 Yuan for a full duck) and some prawns between 2 people. Certainly enough food. The beers were cheap at 30 yuan for 2 but the tea was 128 yuan for a pot which is pricey!

The duck was delicious and better than anything I have had elsewhere.
Total cost about 450 Yuan for 2 people. Would certainly recommend highly.","5 из 5 кружков","8611AB83B87D7C1BBFD9EA21655E6057","Отзыв написан 8 января 2017"
"Best Roast Duck in China! The ambiance is great! Service wonderful. Its better to get there early, have a drink while waiting for your table. Naturally..order the duck and enjoy a fantastic culinary experience!","5 из 5 кружков","3518999CC635BAB7C38843BB2AFB73B9","Отзыв написан 8 января 2017"
"went to the jingfujie outlet on a weekday dinner. ordered duck, steamed fish and asparagus. duck was only moderately crispy and had pretty tough flesh. rather disappointing considering this is one of the best places for peking duck. steamed fish and veg were great though. price is extremely expensive and the duck is probably one of cheaper items","3 из 5 кружков","D2E8BC5FF054066B79274FB980523619","Отзыв написан 6 января 2017"
"I try this famous roast duck restaurant for my dinner and expected to wait for sometimes as it was quite crowded.It was good with a little smell of firewood something unusual but the skin does not melt in the mouth.you have to take the lift from outside the building on the right side facing the main entrance.","4 из 5 кружков","2ED699B89B0184896CDAB32C17DB3889","Отзыв написан 5 января 2017"
"Staff feels a bit stuck up. Duck was the crispiest but that's all. Duck liver was good, like pate. Nothing else impresses.","3 из 5 кружков","8C762870ED2BC068A79B869BC71F3787","Отзыв написан 1 января 2017"
"If you are in Beijing and must try Peking Duck, this will be a good place to eat. The ambience is nice but note that it is on the pricier side. The menu is really filled with choices to spoil you but careful of the prices.","4 из 5 кружков","757E2C54CF06E979660E30064C56AAEB","Отзыв написан 28 декабря 2016"
"Disgusting service,very expensive and very bad food.The roast duck is burnt and other food that we ordered tasted no better than ordinary canteen food despite being five times more expensive.Service was practically non existent,for a glass of water, you need to ask for several times and soup was still not served even after we've paid the bill.There are definitely loads of much better restaurants with fair prices,more delicious food and more traditional surroundings than this overated,modern, vulgarly designed dump that does not reflect any Chinese heritage in both food or dining environment.","1 из 5 кружков","7EB06828257FDDBC8E4F18BC3CE2DD17","Отзыв написан 27 декабря 2016"
"The roast duck was nice, up to standard, crispy and doesn't feel greasy so it's definitely worth a visit in Beijing.

The interior design was a little on the quirky side but food was nice.","4 из 5 кружков","9FCB7771973652039142735B34265775","Отзыв написан 23 декабря 2016"
"We wanted to try Peking Duck whilst in Beijing and read in the Lonely Planet & online about Da Dong. We made a booking however we arrived at the wrong branch of the restaurant. However the staff were still able to seat us at a shared table which was still fine. We ordered a roast duck with 2 sets of condiments for my husband and I this was plentiful. It included soup and a fruit platter. The duck was the most amazing duck we have ever tasted. Very lean but still delicious crispy skin. I would recommend booking (and checking not is the correct branch) as many of the private tables had excellent views over the city.","5 из 5 кружков","EC715668079B21BBC8D6A7F501A339DA","Отзыв написан 21 декабря 2016"
"Had dinner with a colleague at Da Dong. Heard some negative sounds as this is a tourist trap and not up to the standard 'real' Chinese aim for.
The duck we had was roasted to perfection, not fat, crispy skin and delicious flavor.
Also the staff cutting the were fabulous and knew exactly what to do. Briliant presentation!!
Highly recommended.","5 из 5 кружков","73BA92423CBDE2008454B0825A35193C","Отзыв написан 14 декабря 2016"
"The restaurant looks outstanding, i was afraid of being too expensive. But i was wrong! It is far not so expensive, absolutely fair for the quality you get. Everybody is professional, and really kind. The food is delicious. You must try!","5 из 5 кружков","FFDBDBE1ECD0417311562B86DF136483","Отзыв написан 12 декабря 2016"
"My friends and I had roast duck at Da Dong twice, simply because it was so good. We've tried Duck de Chine and Jing Yaa Tang which were not bad, but this is really the best.

Service was also impeccable. The servers took the time to explain to us how we were supposed to eat the ducks, and they also gave us complementary shaobing (hollowed biscuits that you stuff the meat, radish, minced garlic and hoisin sauce in, a specialty that only Da Dong has), when we said we really liked it.","5 из 5 кружков","D2DD1BC40689106360175E0A14C426CD","Отзыв написан 10 декабря 2016"
"We made reservations for Da Dong (recommended by friends and coworkers) to have Peking Duck and more. This is a ""chain"" restaurant, so we were able to walk to the closest one to our hotel. We are so happy we got to eat there! The food and service were excellent! You can watch the chefs make the duck in their ovens if you sit close enough. Although the servers did not speak English, we used Google Translate and pointed -- it worked! We got everything we ordered!","5 из 5 кружков","C4B9C3A4A98EB3300EB7103EB1B7DE9A","Отзыв написан 8 декабря 2016"
"We have been eating Peking Duck in the US for over 25 years and so were excited about our eating it in Beijing. We made a reservation at Da Dong which was well reviewed and near our hotel.

First, the attitude was wrong. They wanted us to sit next to the waiter's station ... sorry, but no. Next choice another waiter's station. Now time for the manager and after a conversation and a wait we were seated in the main room. If you are here for the decor then this restaurant is a winner.

However, it is not a winner if you want the famous duck unless presentation is more important than a dry, bland duck hurriedly served as if it was fast food. Move you in, serve you and move you out.

And the Las Vegas production of grapes for desert in no way makes up for the unsatisfactory service or food.

Again, sound and fury signifying nothing. Look elsewhere, even in the US for excellent Peking Duck.

The Bs","2 из 5 кружков","478E00F8CD62E883DBF1757A7E40D24B","Отзыв написан 7 декабря 2016"
"Our tour guide took us here our first night in Beijing. The restaurant was close to our hotel so we just walked over from the Regent. We ordered the duck, of course, and then our guide ordered us about 8 other dishes to go with it which was way too much for us. But we tried a little of everything. Everything was sooooo good... The food was wonderful, the restaurant itself is very nice....and busy, busy! If you have room try the fried ice cream for dessert. I would definitely recommend trying this restaurant if you are in Beijing and especially if you are staying at the Regent. Just for fun we checked out the other restaurant on the same floor which is a movie themed restaurant and has rooms decorated according to different movies. I've never seen anything like it..... very interesting place","5 из 5 кружков","F972E6ECA4391703801D358C513BA275","Отзыв написан 5 декабря 2016"
"The restaurant is magnificent, starting from a beautifully decorated garden. The interior of the restaurant is also excellently designed and decorated. The food is just marvellous, Fusion Chinese Cuisine, that takes Beijing Duck in another level. All traditional plates taste zillion times different, while you appreciate the well organised place in every aspect. No smell, no dirt, no smoke..... something rare in Beijing! Enjoy!","5 из 5 кружков","BDE2F5CF043517219647E359C70E6FEF","Отзыв написан 5 декабря 2016"
"We wanted to find a highly recommended authentic Mandarin restaurant in Beijing and this exceptional restaurant exceeded expectations.
Not easy to find but spacious surrounding gardens lit up at night are the first clue of a special experience about to unfold.
A large space with high ceilings and dramatic sculptures set the stage. Much of the menu is alluring but I recommend following the signature dishes. An extensive wine list provides many options, although back your judgement on wine selection rather that the service staff recommendations.
The Peking Duck is legendary and for good reason. The wagyu with lime and ""chicken soup"" were also spectacular.
Oh, and a massive screen showing the celebrity chef's travel adventures.
Worth the wait but book if you can.","5 из 5 кружков","F4B475AF1AAAC63DAE4118DD553DAE98","Отзыв написан 4 декабря 2016"
"I was in Beijing for a business trip and one of our customers decided to bring us here for dinner and everything was simply delicious. Totally recommend the roasted duck....it is amazingly good.","5 из 5 кружков","3134734D7777CFCFE29CD0BC11790343","Отзыв написан 27 ноября 2016"
"First of all - the duck is fabulous! Like all the reviewers mentioned - one of the best duck you will find. But the service was just so terrible and the staff so rude that the duck did not make up for it.
We went for lunch at about 1:30 and there was no line - we were given a table immediately. As we were looking through the big book of a menu trying to decide what appetizer and dessert and drink we wanted with our duck, this really rude lady comes up to the table and asks ""what duck?"" I understand the lack of english but it does not take a language to identify rude behavior! I pointed at their roast duck and ordered one. We told her we are still deciding the rest. And after 5 minutes while we were still looking at the pretty pictures hoping to order some appetizers, she comed back and plops chopsticks and plated in front of us. We expected the duck to be carved in front of us but this chef just carved it behind our table - I asked her if that was our duck quite shocked actually and she said yes. We did not order more after that. I told her that she did not even take our order but she did not seem to care.
I know that language can be a problem in China but I have had really good food over the last 2 weeks at much simpler places here - even at places where the staff spoke 0 english but this is the first time in China where I have been treated so rudely. I would much rather eat a less tasty duck at a friendly place than the perfect duck at a place like DaDong - that is purely a personal preference. I am not going back here again and would not recommend this place to friends and family.","1 из 5 кружков","ADAFDF2420C7B23F139458595877ACF9","Отзыв написан 27 ноября 2016"
"We went to Da Dong on a recommendation from a family friend. While we wait for almost 2 hours, it was worth it. We ordered one Peking duck to split among three people and it was enough. We also ordered two more side dishes. Everything tastes great, and the food was quickly served after ordering. One thing that made the wait better was having the free juices. Also, you can grab a seat at the bar.","4 из 5 кружков","CFCD86569F8CF284E4293635BE9D16F1","Отзыв написан 27 ноября 2016"
"I was here while touring Beijing, and If you don't mind spend more than you should
It a very nice place with good quality duck and menu items. But Liked the atmosphere for dinning my GF but i wouldn't come here outside of that....but the duck is good here
That being said...I think the food and duck at Siji Minfu Restaurant off of Wangfujing street is a great deal if not better tasting than this place, its not a modern environment but i think the service and quality is all there","4 из 5 кружков","C71C67B790B351BE49EEDF669F0B5B66","Отзыв написан 22 ноября 2016"
"I love how this restaurant rotates on the axis of the roasting and preparation of the Peking duck. Try to get a table in view of the chefs - it's quite a sight to see them work!

I came alone and was grateful that they serve 1/2 duck. I couldn't finish it but did my best. I also ordered the mung bean sprouts which are probably the best greens I have ever had.

One of the servers took extra care to show me the trick of folding the wrapper with chopsticks - look ma, no hands! - and came by later to make sure I was doing it right.

The tangerines on dry ice at the end was delightful. And they were sweet like candy, so no need for dessert.

Fantastic food and great service in a modern setting.","4 из 5 кружков","38ABDB11FB82176AD2B064D85C18A68C","Отзыв написан 21 ноября 2016"
"Excellent restaurant. All dishes were very tasty with great plating. All personnel from reception to the waiters are very professional and helpful, kind and smiling.","5 из 5 кружков","D9B483724D4CE42B7545B72F6381AA02","Отзыв написан 20 ноября 2016"
"We enjoyed our dinner at Da Dong Roast Duck's Tuanjiehu location. They had excellent cocktails, wonderful service, clean modern restaurant. However, this was my first Peking Duck and I was not a fan of the crunchy bird. I like my duck moist and tender. But the restaurant was great. Had I known what the Peking duck was like, I may have ordered a large bird for just the two off us so I would get more meat. None the less, I would go to this restaurant and order something else. It was a good restaurant.","4 из 5 кружков","8F515D709651C9840645216BCC9A5426","Отзыв написан 17 ноября 2016"
"Visited a few years ago. My wife and I dinned with her business companions. This is a great looking restaurant with a view of the duck cooking display. The service is beyond excellent. A lively atmosphere that offers a great dinning experience.

Visit and enjoy.","5 из 5 кружков","19A97367D51CDFA054EA453718711E7E","Отзыв написан 16 ноября 2016"
