"review_text","review_stars","review_auth_id","review_date"
"Our hotel made reservations for us at 9 PM. We arrived at 10 minutes after nine and was seated immediately. Waited about 30 minutes to have a waiter come over and take our order. When he finally took our order., He told us there was no more duck available! How could a restaurant known for peeking duck, and not have any peeking duck left. We spent the next half hour arguing with the management to make us a duck, because, it was not that they had no ducks available, it's that they wanted to close and did not want to make any more duck. Finally, they agreed to give us a half of one duck! This was after we had to even call our hotel and have the concierge intervene. We had only one night in Beijing, as we explained, and this was going to be our only mail and our only chance to have peking duck. We also ordered fish, which on the menu was approximately US$20 for 500 g. To our surprise, they charged us, three people, for 2.5 kg! Almost $100 US. There was so much fish, we could not even finish it. The food was very good, but the experience was made miserable and expensive because of the poor service and unwillingness to make any efforts. There are many restaurants in beijing and, judging from my experience tonight, I will never return. Unfortunate, because I have been there many times. They need to understand what customer service is. When they see people, they need to make sure that they can serve them the full menu, not only what they choose to cook for lack of time! The Chefs just wanted to go home, and that's why they refused to cook us a duck","1 из 5 кружков","8C4C02A3FBFCAFE2438C902D1E61C13E","Отзыв написан 12 ноября 2016"
"A beautiful place to try some traditional dishes splendidly presented. The duck is sublime. So are the desserts. Service is generally good.","5 из 5 кружков","C1DB79E848620F9A2F1394BED4C0F231","Отзыв написан 12 ноября 2016"
"This restaurant was recommended by our concierge for the Roast Peking Duck. We did not have reservations but went to eat on a Wednesday nite at about 6pm. When we arrived, there were empty tables in the main dining room but the host took the 2 of us to a large round table in a back room with what looked like a curtain for a tablecloth. There were maybe 4 other tables in this back room. We sat there for about 3 minutes before we got up and went back to the Host and asked for a table in the DINING room. For our last, most expensive meal in Beijing, we did not want to sit in a dark back room! A hostess then seated us at a nice table. We ordered 1/2 of the duck, which the waiter said would be enough for the 2 of us, but could have eaten a whole duck. It looks like a lot on the platter but after slicing it up, it was not enough. I would recommend this restaurant, the service was good and the food was good, but don't take a back room table and if there are 2 of you with a good appetite, you can probably eat a whole duck!","4 из 5 кружков","383CA1051561F0BAF166B356FC658C87","Отзыв написан 11 ноября 2016"
"I stood in line here once waiting for a table and an American woman next to me asked me if Da Dong was worth the wait. I replied in the style of the Carlsberg beer advertisements that this was probably the best Chinese restaurant in the world. And it just might be. The Beijing duck is superb (skin melts on tongue) but there are many great Beijing duck restaurants around. What's great here is the other food and as usual we over ordered. Mushrooms with basil, great local dumplings, four gras cherries (must have), a delicious gong bao prawn dish, a fresh broad bean dish and a knockout crab (ok RMB1,700 for a live fresh King Crab) cooked in an egg white sauce that was out of this world. Hong Kong where I live has some amazing Cantonese places but Da Dong is my favorite Chinese restaurant I think and I try to go whenever I am in Beijing. Great cocktails as well! If in doubt, go. Probably....","5 из 5 кружков","59D993BDD7585CCA09CA5E86A86FB2ED","Отзыв написан 11 ноября 2016"
"This meal was fantastic. We went with our local office who pre-booked everything. The chefs took time to show and explain how they prepared and cooked the duck. Service staff attentive and excellent. Presentation, colour and taste of food was outstanding. My best Chinese meal ever.","5 из 5 кружков","E16621E3525FA40C3F85105BCCE0FEF3","Отзыв написан 10 ноября 2016"
"During our recent visit to peking we had the privilege of eating at the above. It was great we really enjoyed it. The duck was the best we ever ate my wife loved it. I liked it very much also. It was probably the best food that we ate in china. The side dishes were also very good but at Da Dong its all about the duck.","5 из 5 кружков","E554F9DA5E5B468D1EBCA58E2AF61B37","Отзыв написан 8 ноября 2016"
