"review_text","review_stars","review_auth_id","review_date"
"Aroma Restaurant definitely deserves to be rated. It is a very great restaurant in all senses including food, service, location and ambiance, I will recommend this restaurant to all of my friends traveling to Beijing, as well it will be my first venue destination when I am traveling to Beijing","5 из 5 кружков","98BB0549963C3E08514AE779E6F1E806","20 февраля 2017"
"I guess by Beijing standards this buffet is pricey, however we found it to be an amazing deal. The food was fresh and plentiful coupled with the attentive Ritz Carlton service we were blown away.","5 из 5 кружков","F5676FF2B1BF3888C1F1597A600F1CC8","Отзыв написан 13 декабря 2016"
"The attention detail is perfection! Great service. So many cuisine choices...representing every corner of the globe. Busy during peak periods but never overbearing. There is live music on Sunday and it adds the perfect touch. Can't stop raving about this place...exactly what you'd expect from Ritz Carlton.","5 из 5 кружков","F447653F3C0B55B2EEDEC1E85DBC9FDA","Отзыв написан 20 марта 2016"
"This restaurant is in the Ritz Carlton Beijing. We ate the breakfast and dinner buffets. They both have a variety of Western and Eastern food. There is more variety for the breakfast buffet. The dinner buffet was very expensive. Dinner for me, my wife and my daughter was almost $200. Granted, there was a good variety of expensive food including...
Ещё ","4 из 5 кружков","CEC5A4898D3DBC6ECD8B9AE2A09DBD6B","Отзыв написан 29 мая 2015"
