"review_text","review_stars","review_auth_id","review_date"
"Wonderful selection but pretty bland food. Most stations with food to order which is great but not much flavor. Steamed...
Ещё ","4 из 5 кружков","3C39F8B79F37A70945913C11C0E5D080","11 марта 2017"
"I only had breakfast at JW Kitchen. It is a bit expensive if it is not included with your room. They have many stations with different kinds of food - juice, japanese, noodles, eggs, western, chinese. It can get crowded as when I was there, there was a big group of people who ate and then left probably for a...
Ещё ","5 из 5 кружков","3BA20ACDF88F2C49CAAF805B8C2B163E","Отзыв написан 7 декабря 2016"
"Buffet restaurant at the JW Marriott. Slight issue with billing, but was resolved to our satisfaction by the hotel management.","4 из 5 кружков","7B8E96388F19989600BAB9DD0ADEE089","Отзыв написан 4 ноября 2016"
"I have to give it to the JW, the JW Kitchen has one of the BEST lunch buffets this side of the great wall. You might be forgiven for thinking you are at a Las Vegas buffet -- excellent food and service. Be warned, napkins can be hard to find :)","5 из 5 кружков","3F78009E6EF37B975D13EE94906340FF","Отзыв написан 29 октября 2016"
"The breakfast was good, and there were lots of variety and options for all paletes. They have a juice station, so you are able to get fresh squeezed juices for breakfast.","5 из 5 кружков","D495AC660E7B3B57EF3BBDE5AC98B08A","Отзыв написан 25 октября 2015"
