"review_text","review_stars","review_auth_id","review_date"
"Visst, hot pot ar hot pot men detta staller tillfor lite extra framfor allt pa upplevelsesidan.
Forst ska man vara beredd pa vantetid, vi fick sitta ca 30 minuter men de har bord for vantan med spel, lite snacks och te. Man kan ga ivag med om man vill, eller ta manikyr.
Sedan nar vi fick bordet var det full rulle, in pa plats, dukar over jackor, bestalla grytor (tog en stark och en mild - ja stark AR jattestark har), lite blandade kott/gronsaker/skaldjur, ga blanda sin sas och sedan vanta pa grytorna blev varma. Servitrisen som tog in oss till platserna och hjalpte till med bestallningen pratade ok engelska, killen som sedan kom och hjalpte till da och da med lagrandet pratade inte alls men gick bra anda - han fixade pa och lite teckensprak sa loste det sig. Personalen ar vanliga och stottande men om man ska saga nagot neg ar det att de alltid ar pa sprang. En av grejerna med stallet ar just att de ar populara och har (vill ha) bra genomstromning pa besokarna.

Nagra tips: ratterna pa menyn t.ex en portion ""assorted meat"" ar ganska stora, vi bestallde typ 5-6 olika saker men pa de flesta tog vi ""half plate"" vilket ar lagom om man ar tva som vi var. Och ja, bestall nudlarna oavsett om du tanker ata dem eller inte, skoj mini-show. Sist men inte minst, lat er inte stressas av att personalen (som ar goa och glada) haller ett hogt tempo utan ta det i er egen takt och njut av en normalt god hot-pot.","5 из 5 кружков","B1935DDFD0B23C69BF9137D21C09C493","14 марта 2017"
"Haidilao Hot Pot has had a reputation for being one of the best chain store Hot pot restaurants in Beijing for many years now. Great service and very good food. I recommend you try it if you want to have some authentic Chinese cuisine while you're in Beijing.","4 из 5 кружков","7BD8DF5BA01E6A6D18BF0EEE4D405B45","10 марта 2017"
"Now we did read that the place was hard to find, and we did struggle to find it. But with the help of the mapsme app we found the general location then used our detective work to figure out it was on the top floor of the shopping mall we were standing (freezing cold) outside of, after having walked around the mall a few times. When we got inside there was a huge queue and an even bigger designated waiting area with chairs and tables and even a serviced nail bar for those of you that want to beautify yourself before you eat. We were seated at the waiting area for about 45mins and were given a few nibbles and drinks while we waited.

We've never done a hot pot before, but we have done a few steamboats in our time... apparently they're not the same thing.
We don't speak a word or mandarin, however the staff were still so helpful when they could see us struggling. It was a lot of fun, very good quality food and a taste of their famous face changing for some light entertainment made the night one to remember.
You have to order the dancing noodles, you won't regret it!","5 из 5 кружков","CDF65610CFFCD2C0D4BCE80078576DCF","6 марта 2017"
"How amazing this place can be?
Certainly the best hot pot ever in my life.
This time they had a seasonal dish: rolls or lamb and fish. Wow! Flavor was out of this world.
Amazing service. Amazing food.
Spicy flavors are a challenge so be careful.","5 из 5 кружков","CA62D25E021FC36DF74BD4364950674A","4 марта 2017"
"This hot pot establishment had amazing service! The waitress gave us hair ties, blankets to cover our belongings, and recommendations for the sauce station. Everything on the menu looked delicious and came out very fresh. We ordered beef, pork, fen shi, and several vegetable dishes. The spicy hot pot was quite spicy, so it's not for the weak of heart. This is great for large groups because you can try more of the menu! The cost was also only around $15-$20 USD, which was great value for our money.","5 из 5 кружков","5EB6CAB074796D6F7F75780860CDEC33","3 марта 2017"
"<U+665A><U+9910><U+6642><U+9593><U+4F86><U+5230><U+6D77><U+5E95><U+6488><U+4E00><U+5982><U+65E2><U+5F80><U+7684><U+9700><U+8981><U+7B49><U+4F4D>,<U+7B49><U+4F4D><U+7684><U+6642><U+5019><U+5EFA><U+8B70><U+53EF><U+4EE5><U+5148><U+9EDE><U+83DC>,<U+9019><U+6A23><U+4E00><U+5165><U+5EA7><U+5C31><U+6709><U+5F97><U+5403><U+5566><U+3002>
<U+4ECA><U+5929><U+70BA><U+6211><U+5011><U+670D><U+52D9><U+7684><U+670D><U+52D9><U+54E1><U+662F><U+6B50><U+967D>,<U+975E><U+5E38><U+89AA><U+5207><U+6709><U+79AE>,<U+800C><U+4E14><U+6642><U+6642><U+7167><U+9867><U+6211><U+5011><U+7528><U+9910>,<U+6211><U+5011><U+5403><U+5F97><U+5F88><U+98FD><U+5F88><U+958B><U+5FC3>!","5 из 5 кружков","6F7475841F4F1EF62EA3D177A6C21515","26 февраля 2017"
"Sono stato con la mia famiglia in questo ristorante seguendo le ottime recensioni di TripAdvisor e devo dire che non sono assolutamente rimasto deluso! Personale molto gentile e disponibile anche se non parla inglese. In pratica si scelgono i cibi crudi e li si cuociono in un brodo (che si puo scegliere e puo essere di due tipi diversi, noi abbiamo preso pomodoro e funghi) che viene posto in mezzo al tavolo. Piatto tipico della citta, davvero ottimo. Prezzi medi (50euro in 4 mangiando molto!!!).
Assolutamente da provare!!! Attenzione che c'e molta gente normalmente (quasi tutti abitanti del posto) ma l'attesa vale la cena!","5 из 5 кружков","07B3425D833EF99EFAB2203A6CA97908","22 февраля 2017"
"<U+9023><U+9396><U+670D><U+52D9><U+5F0F><U+706B><U+934B><U+5E97>,<U+5168><U+570B><U+5747><U+6709><U+5206><U+5E97><U+3002><U+98DF><U+7269><U+8CEA><U+7D20><U+5F88><U+597D>,<U+5728><U+7B49><U+5019><U+5165><U+5EA7><U+6642>,<U+9084><U+63D0><U+4F9B><U+6C34><U+679C><U+548C><U+5C0F><U+5403>,<U+5F88><U+8CBC><U+5FC3><U+554A>!<U+670D><U+52D9><U+54E1><U+77E5><U+9053><U+6211><U+5011><U+662F><U+904A><U+5BA2>,<U+9084><U+5728><U+679C><U+76E4><U+4E0A><U+5B57><U+4E0A><U+6B61><U+8FCE><U+4F86><U+5317><U+4EAC><U+7684><U+54AD><U+7D19>,<U+5F88><U+7AA9><U+5FC3><U+5440>!<U+4F46><U+8A18><U+5F97><U+8981>book <U+4F4D><U+3002>","4 из 5 кружков","28297CE47C2103E1D006EFE37202E60E","21 февраля 2017"
"We had our first experience with Hot Pot at Wangfujing during the summer . It is a fun place with delicious food. We even saw how the make the noodles by hand( great show)","5 из 5 кружков","F31DAE3A6F279A6A0229F49EFF01BAD1","14 марта 2017"
"My wife and I had our first Hot Pot experience at Haidilao. We were treated very warmly throughout our visit; our waitress went above and beyond by helping us choose and then cook the food. The food itself was wonderful.","5 из 5 кружков","D77D2FE30ECB124E7A14DE4C6BAF512F","10 марта 2017"
"We have been here 5 years ago and The taste is not changing since then, we were there around 8pm while the outside temperature was -3 degrees Celcius, so it was a good time to have the hotpot. It a must try Hotpot Restaurant in Beijing and you won't regret it. The Resto always packed with the diners all the time eventhough it opens for 24 hours. We must wait about 45 minutes to have a table for 4 of us. The soup and meat was so nice, also the sauces and condiments buffet so many, try their house specialities sauce. We love it so much. Try it and you will not regret it. A bit pricey but worth it.","5 из 5 кружков","C4998BEBF3E6FAE8020D0A47D9B736A3","20 февраля 2017"
"<U+6D77><U+5E95><U+6488><U+7684><U+670D><U+52D9><U+662F><U+6C92><U+5F97><U+8AAA>,<U+83DC><U+54C1><U+7684><U+7A2E><U+985E><U+4E5F><U+76F8><U+7576><U+8C50><U+5BCC><U+3002><U+5728><U+706B><U+934B><U+5E97><U+88CF><U+9019><U+88CF><U+7D55><U+5C0D><U+662F><U+9996><U+9078><U+3002><U+7BC0><U+5F8C><U+7B2C><U+58F9><U+500B><U+4F11><U+606F><U+65E5><U+4E2D><U+5348>11:30<U+5230><U+7684><U+738B><U+5E9C><U+4E95><U+5E97>,<U+6C92><U+7B49><U+4F4D><U+3002>1<U+9EDE><U+591A><U+51FA><U+9580><U+7684><U+6642><U+5019><U+5916><U+9762><U+7B49><U+5019><U+7684><U+4EBA><U+5DF2><U+7D93><U+5750><U+4E86><U+58F9><U+7247><U+5340><U+57DF><U+4E86><U+3002><U+5169><U+500B><U+4EBA><U+5403><U+4E86>360<U+591A>,<U+4E3B><U+8981><U+662F><U+597D><U+4E45><U+6C92><U+5403><U+4E86>,<U+4EC0><U+9EBD><U+90FD><U+60F3><U+4F86><U+9EDE><U+5152><U+3002><U+4E0D><U+5C0F><U+5FC3><U+9EDE><U+591A><U+4E86><U+3002><U+5F8C><U+4F86><U+90FD><U+6253><U+5305><U+4E86>,<U+5012><U+662F><U+4E5F><U+6C92><U+6D6A><U+8CBB><U+5566><U+3002>","4 из 5 кружков","8BD7EB446A62116001EC3563D66A9713","19 февраля 2017"
"I do enjoy the food and service with my friends ,and you will never feeling wasting time when u got an waiting list number. A lot of snacks and games u can do . I will definitely
Recommend to my friends.","5 из 5 кружков","BC008D875CD448A48BAF91C6CC85A8F3","15 февраля 2017"
"in 88 <U+BE4C><U+B529><U+C774> <U+B9E4><U+C6B0> <U+D06C><U+ACE0> <U+CC3E><U+AE30> <U+C27D><U+AE30> <U+B54C><U+BB38><U+C5D0> <U+CC3E><U+C544><U+AC00><U+B294><U+B374> <U+C5B4><U+B835><U+C9C0> <U+C54A><U+C558><U+C74C>. 8<U+CE35><U+C5D0> <U+C788><U+C74C>. <U+C720><U+BA85><U+D55C> <U+ACF3><U+C774><U+B2C8><U+AE4C> <U+AD00><U+AD11><U+AC1D><U+B4E4><U+C744> <U+B9CE><U+C774> <U+C0C1><U+B300><U+D574><U+BD24><U+C744> <U+AC70><U+B77C><U+B294> <U+C0DD><U+AC01><U+C5D0> <U+C18C><U+D1B5><U+C5D0> <U+C5B4><U+B824><U+C6C0><U+C744> <U+B290><U+B07C><U+C9C0> <U+BABB><U+D560> <U+AC83><U+C774><U+B77C><U+ACE0> <U+C0DD><U+AC01><U+D588><U+C9C0><U+B9CC> <U+C601><U+C5B4><U+B85C> <U+C18C><U+D1B5> <U+D558><U+B098><U+B3C4> <U+C548><U+B428>. <U+D0DC><U+BE14><U+B9BF> pc<U+B85C> <U+C8FC><U+BB38><U+D558><U+B294> <U+C2DC><U+C2A4><U+D15C><U+C778><U+B370> <U+BAA8><U+B450> <U+C911><U+AD6D><U+C5B4>. <U+B098><U+C911><U+C5D0> <U+CC45><U+C73C><U+B85C> <U+B41C> <U+C601><U+C5B4> <U+BA54><U+B274> <U+AC00><U+C838><U+B2E4> <U+C92C><U+C74C>. 4<U+BA85><U+C774><U+C11C> <U+C591><U+ACE0><U+AE30>4<U+C778><U+BD84> <U+C57C><U+CC44><U+BAA8><U+B4EC>2<U+C778><U+BD84> <U+B9C8><U+B77C><U+D0D5>+<U+B9D1><U+C740><U+D0D5> <U+C774><U+B807><U+AC8C> <U+BA39><U+C74C>. <U+B9C8><U+B77C><U+D0D5> <U+B9E4><U+C6B0> <U+C5BC><U+C5BC><U+D558><U+ACE0> <U+B9F5><U+C9C0><U+B9CC> <U+B9E4><U+C6B0> <U+B9DB><U+B0A8><U+314B><U+314B>. <U+C18C><U+C2A4>, <U+C624><U+C774>, <U+CC38><U+C678> <U+AC19><U+C740> <U+AC04><U+B2E8><U+D55C> <U+C140><U+D504><U+CF54><U+B108> <U+C788><U+C74C>.","5 из 5 кружков","E491B957419CFB90651259D7E027B036","10 февраля 2017"
"My mom and I visited this place twice because it was such a nice place.

We had to wait for 40 minutes the first time and 1 hour the next time. I guess it is very common for this place so be prepared to wait. We almost didn't want to the first time we were there but I guess they can't do faster. The host/welcoming waiter said sorry a lot of times and gave us a giftcard to one portion free vegetables.

You can choose to walk around and come back at a decided time or wait in the 'waiting area'. Both times we just decided to walk around and come back because there is so much to see on Wangfujing Street.
But we could see that there was free drinks (cold tea), small snacks (nuts/chips) and you could ask for brickgames, free shoe shining and a place to get your nails done. But because we went for a walk, we didn't use that and cannot say if it was good/bad.

But once you get a table the food is excellent, it is fun to try and the waiters are very serviceminded, smiling and friendly. Even though it looked like we were the only 'non-chinese' we felt us so welcome.

The first time our personally waiter called for the 'welcoming waiter' who could speak more English. She helped us with the booking which was on an iPad. Also, she guided us a bit through the hot pot-concept.
After a while we think the manager of the restaurant came and showed us the 'buffet' of sauces, fresh vegetables and fruit and how to mix them. Also she came with forks even though we didn't asked for them - but they could see we wasn't used to chopsticks, so it was very kind of them.

The waiters come by like every 5 minute. But not to disturb. Just to check if everything is okay. Very nice, because it is so nice to order more, ask for something etc. to the waiter. Also the waiter helped us with preparing the food etc. when it was needed even though we didn't asked for it. Only a very few of the waiters spoke English but all the waiters were very friendly and kind and tried there best to understand us.

We paid about 220 CNY for 2 Sprite (600 ml - which is what they call 'small' - not Danish sizes for soft drinks), 1 portion small sausages, 2 portion meat balls, 1 portion pork slices and 1 portion vegetables to put in the pot (enough for 2 people). Also you have the buffet of salad, fruit and sauces. A bottle of 'okay' wine is about 50 CNY. Very cheap compared to eating on restaurant in Denmark.

This is not traditionally Chinese food but very good food and very good service and also a nice try. If you are in Beijing I would really recommend this but prepared to wait. But it is worth waiting for.","4 из 5 кружков","A5F0350800833452BF8FE1B20D1C02DA",""
"Although I have had hotpots before, wanted to try this because it was ranked #5 in Beijing. Had to wait almost 45 minutes to find a seat (they serve snacks/drinks). It did not live up to the high expectation that we had. The reason can be - Visited a hotpot restaurant for the very first time without a Chinese friend.

Staff was helpful in placing the order and food is not bad at all. Sichuan hotpot was very HOOOOOOT!!","4 из 5 кружков","E1F158A9EBB5770C242A14BF56EA856C","Отзыв написан 6 февраля 2017"
"<U+7B2C><U+4E00><U+6B21><U+4F86><U+5403><U+6D77><U+5E95><U+6488>,<U+7528><U+9910><U+6642><U+9593><U+76F8><U+7576><U+591A><U+4EBA>,19<U+9EDE><U+904E><U+4F86><U+7684>,<U+7B49><U+5019>1<U+5C0F><U+6642><U+5DE6><U+53F3>,<U+7B49><U+5019><U+7684><U+540C><U+6642>,<U+670D><U+52D9><U+4EBA><U+54E1><U+4E3B><U+52D5><U+63D0><U+4F9B><U+6C34><U+679C><U+3001><U+9EDE><U+5FC3><U+3001><U+96F6><U+98DF><U+53CA><U+6DBC><U+8336>,<U+65C1><U+908A><U+9084><U+6709><U+4E94><U+5B50><U+68CB><U+8B93><U+4F60><U+6253><U+767C><U+6642><U+9593>,<U+4E0D><U+6703><U+89BA><U+5F97><U+7B49><U+5019><U+6642><U+9593><U+5F88><U+7121><U+804A>,<U+5165><U+5EA7><U+5F8C>,<U+9EDE><U+4E86><U+5E7E><U+9053><U+83DC><U+4F86><U+5403>,<U+89BA><U+5F97><U+90FD><U+9084><U+883B><U+68D2><U+7684>,<U+98DF><U+6750><U+65B0><U+9BAE>,<U+4EFD><U+91CF><U+5145><U+8DB3>,<U+6BD4><U+8F03><U+7279><U+5225><U+7684><U+662F><U+9084><U+6709><U+5EDA><U+5E2B><U+73FE><U+5834><U+8868><U+6F14><U+62C9><U+9EB5>,<U+62C9><U+597D><U+99AC><U+4E0A><U+653E><U+4E0B><U+934B><U+716E>,<U+6EFF><U+6709><U+8DA3><U+7684><U+3002><U+5EC1><U+6240><U+5167><U+9664><U+6D17><U+624B><U+4E73><U+9084><U+6709><U+8B77><U+624B><U+4E73><U+6DB2>,<U+6D17><U+5B8C><U+624B><U+65C1><U+908A><U+5DE5><U+4F5C><U+4EBA><U+54E1><U+6703><U+99AC><U+4E0A><U+905E><U+4E0A><U+64E6><U+624B><U+7D19>,<U+670D><U+52D9><U+771F><U+7684><U+5F88><U+5468><U+5230>,<U+6D77><U+5E95><U+6488><U+7684><U+670D><U+52D9><U+54C1><U+8CEA><U+53CA><U+9910><U+9EDE><U+6C34><U+6E96><U+771F><U+7684><U+5F88><U+9AD8>,<U+63A8><U+85A6><U+5927><U+5BB6><U+4F86><U+9019><U+908A><U+7528><U+9910><U+3002>","5 из 5 кружков","2E4C8BC72539AADF0225F3B403A3AB1A","Отзыв написан 4 февраля 2017"
"We went here for lunch it was excellent food with huge variety but have to mention their hospitality which is excellent. Pricing for the qtty given is reasonable too. Will surely visit them again. If a fan of hotpot a must try you won't be disappointed.","5 из 5 кружков","E4BB14911A8510499AACE83649DF0635","Отзыв написан 27 января 2017"
"Never been a big fan of chinese food, but ended up liking this place a lot. My bf ordered frogs and pigs brains, I ended up eating tofu, sweet potatoes and beef. The spicy pot isn't that spicy if you're used to eating spicy foods... i.e. indian, thai...

The service and atmosphere were outstanding. Even though we didn't speak any chinese our order was corrent and our waiter was very helpful.","4 из 5 кружков","4DF7150977895723C3ADBE59FEA5C99F","Отзыв написан 27 января 2017"
"Even if you don't know Chinese you will manage to order and eat and enjoy the whole thing, if you take your time.
You choose how spicy one of the hot pot should be and the other one is non spicy. You order meat and vegetables to out inside and wait and eat. They will help you out if you haven't been before and just relax and enjoy. Its great taste and good fun.","5 из 5 кружков","DC28BD487975E74A4E6B33D2A85A97E9","Отзыв написан 25 января 2017"
"A must-go whilst you're in China! You will definitely get the best Hot-pot experience in this restaurant! While you wait for your table, you can play board games and enjoy lots of snacks or you can get your nails done for free (although the queue is insane for that as well).
The service is impeccable, they think of everything: you get a kitchen apron to prevent the stains from crazy boiling hot pot, waterproof bags for phones, charges under the table, elastic bands if you have long hair etc etc etc.
The food is also tasty and diverse! Very impressed!
Highly recommended it!","5 из 5 кружков","FE1100E361CD6A3B35E73224AD9A88FD","Отзыв написан 25 января 2017"
"The restaurant is located at the 8th floor of the ""In 88"" Mall (It's the one with the Prada store at the corner on Wangfujing St.). It was recommended to us, by friends, to try ""Hot Pot"" while in China. We located this restaurant which had positive reviews, and it was conveniently located near our hotel. We tried getting a reservation through our hotel, but they do not accept reservations. So, we walked(10mins!!) over there around 7.30pm on a Saturday evening and we got our names on the w/list - for an 1-hr wait. There is a small number of stuff who speak a little english and with the help of the Google-translate app we were able to understand each-other. Luckily, when we were seated we were served by a very helpful, english-speaking waitress. I can't tell if this happened by chance or by choice, but she guided us through the details of this kind of eating. She helped us order and she helped us pick the matching sauses for our picks. Basically, in hot-pot restaurants, tables have a gas-burning stove in the center where they place a hot-pot. Then, you order various meats, fish or vegies which you boil in one of the soups (the pot is divided in 2 or 4 parts, each with a different soup mix). It is often described as Chinese Fondue. Since I can't stand spicy food, and one of the two soups was ""mildly"" spicy, I eventually had to ""cook"" my items in the non-spicy soup. It was a fun experience, taking into consideration that we were travelling as a family with our 10yo child.","5 из 5 кружков","6F3A314117F115929DD5EBC67BD5D3B0","Отзыв написан 20 января 2017"
"abbiamo trovato questo favoloso ristorante frequentato in maggioranza da cinesi. l'inglese come al solito e poco parlato ma i camerieri sono stati gentilissimi e nonostante le prime difficolta abbiamo mangiato molto bene. scegli cosa vuoi mangiare (hanno un menu con foto dei cibi non cotti) e poi li cuoci al tuo tavolo scegliendo la zuppa base. ottimi sia il pesce che la carne e le verdure. un elogio allo staff gentilissimo e conto veramente basso","5 из 5 кружков","107EA1291BCCE5E42D8BC6600E42B67E","Отзыв написан 14 января 2017"
"Was nice to have food to order only half portion and able to cancel it if its not eaten, lots of condiment is the plus as it adds more flavours to the food cooked, like the kungfu noodles, do infront of you, fresh and tasty will come again some time, was too full,","4 из 5 кружков","DF9CB96BDF934BCE0D54BAF70F00B213","Отзыв написан 13 января 2017"
"Un peu d'attente (une quinzaine de minutes pour 2 personnes), quelques petites choses a manger en attendant. Le personnel est tres aimable et tres serviable, n'hesite pas a vous aider dans le choix des ingredients. Aliments de qualite, service rapide, les prix sont raisonnables pour la prestation. La serveuse a meme offert un pot pourri a ma compagne en partant. Arrivez tot.","5 из 5 кружков","B8074119B405A88AD844A2DDCE846C73","Отзыв написан 13 января 2017"
"This was a delicious meal. The flavors were wonderful and the staff was very helpful despite the language barrier.","5 из 5 кружков","4B90695A06EBCDC31E98BBE6CB2CFD87","Отзыв написан 10 января 2017"
"<U+9019><U+88E1><U+7684><U+4EBA><U+6C23><U+706B><U+934B><U+5E97>, <U+8981><U+7B49><U+5019><U+4E00><U+500B><U+534A><U+5C0F><U+6642><U+624D><U+5165><U+5EA7>,<U+5728><U+7B49><U+5F85><U+5340><U+7B49><U+5019>,<U+6709><U+904A><U+6232><U+68CB><U+89E3><U+60B6>,<U+6709><U+4EBA><U+6DFB><U+8336><U+9022><U+4E0A><U+5C0F><U+98DF>,<U+5973><U+4EBA><U+53EF><U+4EE5><U+514D><U+8CBB><U+4FEE><U+7532>,<U+7B49><U+5230><U+5DEE><U+4E0D><U+591A><U+5165><U+865F><U+7684><U+6642><U+5019>,<U+6709><U+4EBA><U+4F86><U+63D0><U+9EDE><U+4F60><U+7684><U+865F><U+5FEB><U+5230><U+4E86>!

<U+98DF><U+7269><U+65B0><U+9BAE>,<U+670D><U+52D9><U+5468><U+5230>,<U+670D><U+52D9><U+54E1><U+7528><U+5E03><U+84CB><U+597D><U+5916><U+5957>,<U+53C8><U+4F86><U+554F><U+4F60><U+9700><U+8981><U+570D><U+88D9><U+55CE><U+FF1F><U+7528><U+96FB><U+5B50><U+7248><U+9EDE><U+9910><U+5F8C>,<U+670D><U+52D9><U+54E1><U+53C8><U+4F86><U+78BA><U+8A8D><U+4E00><U+4E0B>,<U+8AAA><U+6211><U+5011><U+4E09><U+4EBA><U+4EFD><U+91CF><U+90FD><U+5DEE><U+4E0D><U+591A>,<U+5982><U+679C><U+4E0D><U+5920><U+53EF><U+4EE5><U+518D><U+52A0><U+9EDE>,<U+5176><U+4E2D><U+9EDE><U+4E86><U+8766><U+6ED1><U+3001><U+64A4><U+5C3F><U+725B><U+8089><U+4E38><U+3001><U+670D><U+52D9><U+54E1><U+70BA><U+6211><U+5011><U+653E><U+5165><U+934B><U+4E2D>,<U+4E5F><U+7D30><U+5FC3><U+7684><U+63D0><U+9EDE><U+6211><U+5011><U+6EFE><U+591A><U+5C11><U+5206><U+9418><U+662F><U+6700><U+597D><U+5473><U+9053><U+7684>!<U+9084><U+4E0D><U+6642><U+7684><U+70BA><U+6211><U+5011><U+6DFB><U+98F2><U+52A0><U+51B0>!<U+5982><U+6B64><U+7D30><U+5FC3><U+7684><U+670D><U+52D9>,<U+6392><U+968A><U+7B49><U+4E45><U+4E86><U+4E5F><U+89BA><U+5F97><U+6C92><U+6709><U+4EC0><U+9EBC><U+6240><U+8B02><U+4E86>!

<U+8A18><U+5F97><U+53EB><U+9EB5><U+689D>,<U+6709><U+4EBA><U+5728><U+53F0><U+524D><U+63EE><U+63EE><U+9EB5><U+689D>,<U+624D><U+653E><U+5165><U+934B><U+4E2D>!<U+9EB5><U+689D><U+975E><U+5E38><U+6ED1>,<U+4E00><U+6D41>!","5 из 5 кружков","A0270480E16BD25E00CD8638D3991971","Отзыв написан 8 января 2017"
"We visited Haidilao Hot Pot late December 2016. We waited for about an hour and a half for a table but we expected that because it was the weekend. We ordered the spicy hotpot and the mushroom hotpot. Despite loving spicy food, the spicy broth almost knocked me off my feet. It is not for the weak. Overall, our dinner was great. We really enjoyed the ""noodle man"" that spun the noodles and put on a show at our table. It was a great meal and experience for the price.","5 из 5 кружков","E5976FAD05FB0B8F7C4DC003EA2AD5D5","Отзыв написан 7 января 2017"
