"review_text","review_stars","review_auth_id","review_date"
"We went to Haidilao Hot Pot restaurant on Wanfujing street on January 4th, 2017. We had read some reviews and wanted to try it. For some reason, on Googlemaps it comes up as ""Wangfujing sea fishing pot"", but it's truly Haidilao. Go into the mall that has Tiffany's and Prada etc and go up to the 8th floor. It's right there.

They are apparently usually lined up quite a bit and the wait time can be hours long. We did not experience that, we waited about 10 minutes. That was a bit unfortunate (!!), because we did not get to enjoy the perks offered to waiting customers: playing board games, getting your nails done and your shoes shined! True fact! I put my name down for having my nails down at 19:30 when we walked in, and by the time we left the restaurant after our meal at 21:15 there still were 4 people ahead of me on the list...

When our turn came to get a table, an English speaking staff came to get us and explain the menu and how to order. However, she REALLY RUSHED US! We had to ask her to stop and slow down numerous time. We had not even taken our jackets off that she was showing us a digital menu on an Ipad and saying ""you want this? You want this one? And this one?"" We did not even really know what hot pot was and what the various options were and she was racing to put our order in though the IPad she was holding. She meant well but it took away from our enjoyment a lot.

All in all, we had a delicious meal with more food that we needed for a total of 200RMB. It was delicious although the rushing and atmosphere were definitely lacking. They didn't ask if we wanted to start with a drink, they did not leave us a minute to look at the menu, they were even putting meat into the hot pot for us! It was delicious but not the date night we had in mind.

Pros: the perks for waiting customers, the half portions for couples (hot pot is more suited to large groups), the price, lots of staff ready to help whenever you need them, the bib they give you to wear during the meal

Cons: The rush (we felt like it was a fast food joint the way everything was ordered and delivered to the table in the blink of an eye and under pressure), the smell on your clothes and hair after you leave, the hot pot is built into the table, it is not one of those beautiful copper ones that sits on top of the table like some other restaurants have.

Note: There are various types/flavors of broth. The spicy one is VERY spicy. I tolerate spicy food very well but this was WAY above my enjoyment threshold.
Order noodles! A boy will come to your table to stretch the noodles in some form of ""Cirque du Soleil performance"" you won't believe!

If you want a relaxing atmosphere for a nice meal out, this is not the place. It's best for large groups, it's loud and it's very busy and stressful being there and ordering while they pressure you to make decisions very fast. If you want to simply experience Chinese hot pot, and possibly enjoy the perks of the waiting lounge, this is a good place.","4 из 5 кружков","6DF325BCBF1EC32A325BA517A8DA391C","Отзыв написан 4 января 2017"
"Whether you like hot pepper/spicy hot pot or just no-spicy hot pot, you should try any one of Beijing Haidilao Restaurant (translating to English - fetching the bottom of the ocean). You can order a split soup base with both Spicy and nonspicy (mushroom) soups and certainly try the prime ribeye slice, Australian lamp slices, fish, and tofu and other items as you like. You can mix your own source or ask for help from the waitress. All the stuff are well trained (very high standard locally), polite, and helpful. You can also pick up the fruits and congee as much as you like. The locals love the restaurants as well. Be careful of your food allergy - point out this to the waitress here who can help you out. The fresh made noodle is also a must - as the chef made the noodle on site.","5 из 5 кружков","F5A4EC10B0DF82B31D3B241152704488","Отзыв написан 2 января 2017"
"Service was attentive but the layout feels cramped. Go early or much later to avoid the crowd, wouldn't queue for it.","3 из 5 кружков","8C762870ED2BC068A79B869BC71F3787","Отзыв написан 1 января 2017"
"I do not usually write reviews for food, but had to in this case due to the warm hospitality I received while my family and I were there.

We went on the eve of Christmas (we tried going on Saturday previously but waited over an hour, but the queue was not really moving). My family and I were taken aback by the warm hospitality that we received at the restaurant - they provide food, manicure services, and other forms of entertainment to entertain you while you wait. I would say that this is the first time that I have received such service before. The staff there were very friendly, especially one female staff, Ms <U+674E><U+6653><U+971E>, who was particularly accommodating and patient.

The food was served really quickly after we had ordered it. We ordered Mala (it's really very spicy even for the least spicy option!) and mushroom base (must try!). We also ordered seafood, meat and some vegetables to complete the meal. Free flow of sauces and tomatoes, among other snacks are available.

Generally, I would advice potential visitors to make a booking before they arrive as the queue can get REALLY long (~20-40 groups ahead of you). Otherwise, visit the shop on the weekdays for a shorter queue.","5 из 5 кружков","7D815647EFC9DE941E5C27E2DAFA5C5B","Отзыв написан 1 января 2017"
"Popular and can be a long wait but it is worth the wait. They will give you snacks and a drink and board games while waiting. Food is great! Fresh and different siup base to choose from. Make your own combination of sauces!","5 из 5 кружков","925D301A3AE9B659B69CEDB9800E6116","Отзыв написан 31 декабря 2016"
"Liked the place, the concept and the service. If you are from the west, you must visit the place at least once while in Beijing.","4 из 5 кружков","025760068EB0987966B3CF768E812410","Отзыв написан 31 декабря 2016"
"Fantastic food. Found it from trip advisor. It's on the top floor of In88 in Wangfujing street. Easy to find. We went there after visiting Forbidden palace, was cold and hungry. We were so happy coz the food comes fast and the service was excellence. No problem if you can't speak or read Chinese. The waitress was so helpful in explaining and suggesting dishes and portion for 3 of us. Wonderful experience, will definitely go back the next time in Beijing.","5 из 5 кружков","38354FD74306B5636F2D6089F273D781","Отзыв написан 29 декабря 2016"
"We tried the two-sided soup, one with spicy numbing peppers and the other a white mushroom broth. The lamb, lotus root, and bamboo were particularly good. We followed the lead of other diners when making our sauces at the huge sauce bar, and whatever it was we made, it was great!","5 из 5 кружков","7D813984983B90CBF5442AD0EDA7F107","Отзыв написан 28 декабря 2016"
"This restaurant specialist in hot pot... the restaurant is nice... the service is nice...lobe the soup... so many choices... and the seasonings sauce is so many choices too... love the tomato soup...","4 из 5 кружков","A1F268411BF3B999B7A0C26850793183","Отзыв написан 28 декабря 2016"
"The service is very good and the food are also good. Just to many people and have to wait a long time.","4 из 5 кружков","4A2F52351B76C3057162AB26A04AF190","Отзыв написан 21 декабря 2016"
"We ate here twice within our 5-day trip. Wide variety of broth from which you could chose up to 4. The super spicy one is insanely spicy. The mushroom broth is a must have as well. We loved the idea of the variety of sauces provided where we could mix up our concoction. The meat and vegetables were top quality. We ate for 2 hours and chose almost everything from the menu. The total bill was only CNY 360 for 4 of us. I hope they would open one in Malaysia.","5 из 5 кружков","6ABE817AF893F87A13885D66C6B21A67","Отзыв написан 20 декабря 2016"
"First of all, the food is simply delicious. The sauce bar is unbelievable, has many options so you can customize your hot pot sauce perfectly to your taste. You will not leave hungry, as in addition to the hot pot, there are free snacks and fruit for before and after your meal. Sometimes, there is a wait, so they supply you with games, snacks, and drinks, while you wait. The customer service is really impeccable, and this is somewhat of a rarity in China, which makes is extra special.","5 из 5 кружков","EB7341C50E3C9049B6FBCA2DEA7B6B99","Отзыв написан 20 декабря 2016"
"Hai Di Lao merupakan resto yg memiliki banyak cabang di Beijing. Menyajikan menu hot pot dengan berbagai pilihan kuah dan saus. Anda juga bisa memilih isi sup sesuai keinginan anda.","5 из 5 кружков","6173E7A6977ED2B1E5396C4216E4A19A","Отзыв написан 20 декабря 2016"
"After having some difficulties finding the place we found the entrance and from there since they saw we were tourists we got a lot of help and they gave us a table real quick, and even though no body really spoke english we eventually understood each other and had a lot of fun!
Never were at a HotPot place before, it's really fun.
Basically you order the type of ""soup"" and then order/take everything you want to throw in it and boil it.","5 из 5 кружков","7D67E29697414E4F0887362468CB24F3","Отзыв написан 18 декабря 2016"
"<U+B9DB><U+B3C4> <U+C788><U+C9C0><U+B9CC> <U+C774><U+B807><U+AC8C> <U+C11C><U+BE44><U+C2A4><U+AC00> <U+C88B><U+C740> <U+ACF3><U+C740> <U+CC98><U+C74C> <U+BD24><U+C5B4><U+C694>.
<U+C6CC><U+B099> <U+C778><U+AE30><U+AC00> <U+B9CE><U+C544> <U+AE30><U+B2E4><U+B9AC><U+B294><U+B3D9><U+C548> <U+B124><U+C77C><U+B3C4> <U+BB34><U+B8CC><U+B85C> <U+BC1B><U+C744> <U+C218> <U+C788><U+ACE0>, <U+C2DD><U+C0AC><U+D560> <U+B54C> <U+BA38><U+B9AC><U+C5D0> <U+C591><U+B150> <U+B4F1> <U+BB3B><U+C9C0> <U+C54A><U+B3C4><U+B85D> <U+BA38><U+B9AC><U+B048><U+B3C4> <U+C81C><U+ACF5><U+D558><U+ACE0>, <U+D578><U+B4DC><U+D3F0> <U+BE44><U+B2D0><U+BC31> <U+C81C><U+ACF5> <U+B4F1> <U+C11C><U+BE44><U+C2A4><U+AC00> <U+B108><U+BB34> <U+C88B><U+C544><U+C694>.
<U+B9DB><U+B3C4> <U+C788><U+C9C0><U+B9CC>, <U+C11C><U+BE44><U+C2A4><U+AC00> <U+B108><U+BB34> <U+C88B><U+C544><U+C11C> <U+B2E4><U+C74C><U+C5D0> <U+AF2D> <U+C5B4><U+BA38><U+B2C8> <U+BAA8><U+C2DC><U+ACE0> <U+C624><U+ACE0> <U+C2F6><U+C5B4><U+C694>. :)","5 из 5 кружков","2B3A23AE91A71760707FED1B3ECA3F12","Отзыв написан 17 декабря 2016"
"Quisimos ir para probar el HotPot por primera vez, sin tener ni idea de lo que era... El bar estaba MUY lleno de chinos y tuvimos que esperar un rato para tener mesa. Nadie hablaba ingles... Asi que no entendiamos nada: al llegar te dan un numero y nos pusieron en una mesita con un pica pica para esperar... Dicen el numero por megafonia cuando es tu turno (en chino, claro), por lo que no parabamos de interceptar camareros para preguntar con senas si ya habian dicho el nuestro... Luego fuimos a nuestra mesa y nos dieron una carta toda en chino... Copiamos lo q hacian los de al lado para poder pedir: resulta que pides uno o dos caldos en cuyo interior luego tu mismo cocinas los ingredientes que le quieras anadir! Fuero muy atentos a pesar de no entender ni papa... La cena en si fue super divertida y un gran show! Vale la pena lanzarse!","4 из 5 кружков","B5679B9FC2CB450594746C88B3B40FBA","Отзыв написан 16 декабря 2016"
"What a wonderful experience. Where else can you get your boots/shoes cleaned and a manicure for free, while you wait for fabulous hot pot! My guide Sunflower of Sunflower Tours took me to this place and it was spot on! I got to try all the different items she recommended and we had a lovely time. As a beginner I might have been otherwise intimidated although they do have an English menu. Sunflower she rolled right through all the items, picking what was the best to try. We even got to try the fabulous hand tossed noodles and I have a fabulous video on my FB page @carryonforone you can view. Highly recommend! Also if you need a tour guide while in Beijing, I recommend Sunflower Tours as well. Enjoy and bon appetite!","5 из 5 кружков","063EA7A2EB7DA35D1333DB8F86A3349A","Отзыв написан 14 декабря 2016"
"Was advised to go to this restaurant by our guide in Beijing. We were very happy we followed her advise! This quite big restaurant is a nice experience! A must do when U are in Beijing. U get seated around ""hot pot"". From the menu u can try to choose what U want... But best way is to tell staff to bring what they think is best. The menu is so large that it really gets difficult to choose, certainly as a foreigner! Food was good and loved the atmosphere! Order the pasta-show!","4 из 5 кружков","92A4D3E979FF3046996026B8426D672F","Отзыв написан 13 декабря 2016"
"I wish I knew more about how to eat ""hot pot"" but the staff was helpful. Really good food. Lots of choices. I would do 4 different pots and lots of items. We got a lot of help and had fun too.","5 из 5 кружков","8C369A3F7CFBC7A400FA69050BC3CCF3","Отзыв написан 6 декабря 2016"
"Best experience in a restaurant. A waiter/waitress per section (6 or so tables) comes and check on you frequently and there are others going around to serve you the best they can. So cheap, bloated ourselves only on 250 yuan. Food is delicious and waiter helps you and show how to cook. They order on ipad with pictures so easy to get around. You can also order half sized dishes. Must order a noodle (myen) that a noodle chef comes and makes, so entertaining. Will definitely visit again.","5 из 5 кружков","0058A658D44A73AE295A0E7E0A2303B6","Отзыв написан 1 декабря 2016"
"Great services and always warm welcome. No doubt their hotpot and fish ball is very tasty with the tomato soup. I was there in the cold winter last week, and the services staff saw me shaking even sitting in the restaurant already, so she came back with a blanket for me to keep me warm and enjoy my food ! Thank you again really impressed by your team","5 из 5 кружков","1A873E0DE8E5C052BA9673B182110F9C","Отзыв написан 29 ноября 2016"
"<U+6D77><U+5E95><U+6488><U+524D><U+5E7E><U+5E74><U+662F><U+6BD4><U+8F03><U+706B><U+7206><U+7684>,<U+52A0><U+4E0A><U+53C8><U+662F>24<U+5C0F><U+6642><U+71DF><U+696D>,<U+70BA><U+5F88><U+591A><U+591C><U+8C93><U+5B50><U+63D0><U+4F9B><U+4E86><U+4E00><U+500B><U+5C08><U+9580><U+4EAB><U+53D7><U+7684><U+5834><U+6240><U+3002><U+4F46><U+9664><U+4E86><U+670D><U+52D9><U+54C1><U+8CEA><U+5099><U+53D7><U+5C0A><U+5D07><U+5916>,<U+83DC><U+54C1><U+6C34><U+6E96><U+4E26><U+6C92><U+6709><U+6BD4><U+4E00><U+822C><U+706B><U+934B><U+5E97><U+9AD8><U+51FA><U+591A><U+5C11>,<U+552F><U+4E00><U+503C><U+5F97><U+63A8><U+85A6><U+7684><U+662F><U+8766><U+6ED1>,<U+9019><U+500B><U+83DC><U+5F0F><U+5F9E><U+54C1><U+8CEA><U+5230><U+670D><U+52D9><U+4E0A><U+90FD><U+53EF><U+4EE5><U+8AAA><U+662F><U+4E00><U+6D41><U+7684><U+3002><U+5927><U+6982><U+6D77><U+5E95><U+6488><U+5728><U+5317><U+4EAC><U+7684><U+4F5C><U+7528>,<U+662F><U+57F9><U+8A13><U+4E86><U+4E00><U+6279><U+8077><U+696D><U+7D20><U+990A><U+8F03><U+9AD8><U+7684><U+54E1><U+5DE5>,<U+6574><U+9AD4><U+63D0><U+9AD8><U+4E86><U+5317><U+4EAC><U+7684><U+670D><U+52D9><U+696D><U+6C34><U+6E96><U+5427><U+3002>","3 из 5 кружков","D6FAC4B33D328A46B2CB037316B49343","Отзыв написан 25 ноября 2016"
