"review_text","review_stars","review_auth_id","review_date"
"Very surprised at the decor of the restaurant. Had a classic/conservation charm to it. We were at a table in the middle of the restaurant where there was a Chinese Opera performance throughout dinner. On these two fronts, I give 5 stars. Food-wise, I wasn't that taken away. Food was average at best. Im not going into specifics here as...
Ещё ","4 из 5 кружков","77FAC00579481CDD8BD5C900DB5518F5","Отзыв написан 20 октября 2016"
"The decor is amazing and the dishes also. If you go there for dinner you can catch the Peking opera performance and get some complimentary stuff from the restaurant. It is a very nice authentic Beijing experience.","5 из 5 кружков","2E1DD600CE87C17B3C9F62743FDE37E0","Отзыв написан 24 сентября 2016"
"Beijing Jan is hidden away inside an ultra modern office block and designer shopping mall. Once inside you would never know it. The first experience is the decor transporting you into a traditional if very high class Chinese building. At the centre of the main room there is a stage. A short, about 10 minutes, performance of Chinese Oprah took...
Ещё ","5 из 5 кружков","2FB3AF39F902CDF3986676AEF82953D6","Отзыв написан 31 марта 2016"
"I went to Beijing Yan <U+5317><U+4EAC><U+5BB4> with a group and was totally blown away by the service and food. The atmosphere and decor was also unbelievable. We were in a private room and enjoyed the opera. Just a serene and enjoyable experience! I cannot recommend this restaurant highly enough. You must visit while in Beijing!","5 из 5 кружков","C175DF3C89DB024101F083542A411BDE","Отзыв написан 13 октября 2015"
