"review_text","review_stars","review_auth_id","review_date"
"This place is a little oasis for me when I come to teach in Beijing. Well prepared American style food, good service and good internet connections. A nice place to sit and work on stuff for s few hours. A little pricey 10$ for a salad. But if you are missing home food, it's well worth it to me.","5 из 5 кружков","B27848F79B96F6AC7BCD87822E5C1263","Отзыв написан 31 декабря 2016"
"This place is popular among internationals because of its environment, people and food. We usually used to be there for study","5 из 5 кружков","B90605C343C607FAA709CA0BC27713EE","Отзыв написан 19 ноября 2016"
"Нашла заведение случайно, пока гуляла. Решила зайти. Цены средние для заведений не китайского типа, мест много, интересный интерьер, кухня европейская. Однако официанты нерасторопные совершенно и не ориентированы на иностранцев (район не туристический), тем не менее попросила меню на английском, даже этого не поняли, но это ведь Пекин, так что не была удивлена, сталкивалась с таким каждый день.","3 из 5 кружков","9BFB0AC8CF29FA0531B82D692C76D37F","Отзыв написан 10 июля 2016"
"<U+3044><U+308D><U+3093><U+306A><U+30E1><U+30CB><U+30E5><U+30FC><U+304C><U+3042><U+308A><U+307E><U+3059><U+3002><U+30A2><U+30A4><U+30B9><U+30AF><U+30EA><U+30FC><U+30E0><U+304C><U+304A><U+3044><U+3057><U+3044><U+3067><U+3059><U+3002><U+30CF><U+30FC><U+30B2><U+30F3><U+30C0><U+30C3><U+30C4><U+5E97><U+306B><U+6BD4><U+3079><U+308B><U+3068><U+5B89><U+3044><U+3067><U+3059><U+304C><U+304A><U+3044><U+3057><U+3044><U+3067><U+3059><U+3002> <U+30B9><U+30A4><U+30FC><U+30C4><U+30E1>...
Ещё ","5 из 5 кружков","065CD9D67C4C32B11E0781A8EA3E0923","Отзыв написан 14 мая 2016"
"...but a good place for a light break... It's almost ""starbucks-style"" in Beijing... I like it, and I came here a few times, even just to have a beer and relax...","4 из 5 кружков","030175B51522C97AE20FAFC498C615E2","Отзыв написан 21 декабря 2015"
"I stayed at the Park Plaza in Science Park ( a great hotel by the way) and the Bunny Drop opened just around the corner. It is open until midnight, with a wide array of sandwiches and snacks. Coffee and smoothies rock! We ate breakfast 5 times there, and bought Mooncakes too!","5 из 5 кружков","39F277A468E6126DBC4841A78D8B2F1D","Отзыв написан 13 октября 2015"
