"review_text","review_stars","review_auth_id","review_date"
"relaxed atmosphere, huge range of beers, good staff. Friday night gets busy but that's what you'd expect! taster trays allows you to experiment too we ordered from the mexican next door and it was disappointing - the food from the pub itself looked better in retrospect!","4 из 5 кружков","CDEEA1C94BC41DA8DA397003563A6359","Отзыв написан 20 декабря 2016"
"Friend brought me here to chillout after work. It is not overly-crowded, not overly-local style but more of a mixed style. I didn't quite understand what is the exact craft beer i chose, but the taste were generally good. If you preferred bottle alcohol, they also have a wide range of it in the huge chiller for you to pick...
Ещё ","4 из 5 кружков","42B6BC3A0F7342222B1A92A3A044B6AA","Отзыв написан 29 июня 2016"
"You like craft beer? You're anywhere near Ping'anli metro? This little hidden gem is a great place to spend a little beer and relaxing time. Hidden is by no means a misname, unless you know it's there you'll never find it. Starting at Ping'anli metro exit B turn right along the main road and after about only 10 metres turn...
Ещё ","4 из 5 кружков","E84BA6ADA42777E41AE35E3DB2403D04","Отзыв написан 20 июня 2016"
